reviewId,language,rating,date,content
161595320,ko-KR,5.0,2019년 10월 17일,한국의 가장 중요한 궁궐 중 하나인 경복궁은 고층 빌딩이 즐비한 서울의 중심부에 자리 잡고 있습니다. 전통적인 궁궐 건물입니다. 한국을 여행하신다면 한복을 입고 경복궁에 들어가 왕실의 여유로운 시간을 만끽해 보세요.
161497573,ko-KR,5.0,2019년 10월 11일,"궁궐은 매우 선명한 색감을 자랑하여 사진 찍기에 안성맞춤입니다. 한복을 입으면 무료 입장이 가능합니다. 공간은 넓어서 지치지 않고 둘러보기 쉽습니다. 사람이 많이 몰리지만, 광장은 모래가 많아 신발에 모래가 쉽게 들어갈 수 있습니다. (ಥ_ಥ)"
193230032,ko-KR,4.0,2024년 9월 22일,"한복을 입고 사진 찍기에는 완벽한 곳이지만, 인파와 사진 찍기 어려움을 피하려면 일찍 가는 것이 좋습니다. 한복을 입으면 무료 입장이에요.
눈이 내리는 겨울에 가는 건 정말 특별한 경험인데, 날씨가 엄청 춥고 🥶 걸을 때 정말 조심해야 해요 👀

그날 아침 순찰하는 걸 우연히 봤는데, 엄청 추웠지만, 그래도 그럴 자격이 있다고 생각했어요 🤣🤣"
192497054,ko-KR,4.0,2024년 9월 13일,"한국에서 꼭 가봐야 할 명소 중 하나!
참고:
1. 경복궁은 화요일에 휴관하니 놓치지 마세요.
1. 한복을 입으면 무료 입장입니다.
3. 경복궁 옆 골목에는 한복 대여점이 많습니다.
경복궁에서 한복을 입는 것은 정말 멋진 경험입니다! 사진이 정말 잘 나오고 아름다운 사진을 많이 찍을 수 있습니다. 게다가 한복 대여는 저렴하고 가성비도 훌륭합니다!"
191468090,ko-KR,4.0,2024년 9월 1일,"한복을 입으시면 입장료를 내지 않으셔도 됩니다. 경복궁은 규모가 크지 않아 30분 정도 둘러보실 수 있습니다. 벚꽃나무가 많아 아름다운 사진을 찍을 수 있습니다.

경복궁 근처 쇼핑가도 방문하기 매우 좋습니다. 익선동이라는 곳에는 작은 상점들이 많아 구경할 거리가 많습니다. 북촌 한옥마을과 제가 경복궁에 갈 때마다 꼭 들러보는 토속촌 인삼닭국이라는 식당도 있습니다."
163112488,ko-KR,5.0,2020년 3월 26일,"1. 경복궁
이곳은 고전 중의 고전입니다. 방문하지 않으면 뭔가를 놓친 것 같은 기분이 들 것입니다. 물론 자금성보다는 훨씬 작지만, 역사적인 건물로서 여전히 방문할 가치가 있습니다. 안으로 들어서는 순간 드라마 &quot;대장금&quot; 속으로 들어가는 듯한 느낌을 받습니다. 한복을 입은 많은 관광객들이 건물 앞에서 사진을 찍습니다.

교통편: 경복궁역(3호선) 5번 출구; 안국역(3호선) 1번 출구. 경복궁역에서 하차하세요.

운영 시간: (화요일 휴관) 09:00~17:00 (매월 운영 시간이 약간 변경될 수 있습니다.)

입장료: 성인(25~64세) - 개인 3,000원 ​​(한복 착용 시 무료 입장)

추천 관람 시간: 1시간"
195004895,ko-KR,5.0,2024년 10월 12일,"서울의 필수 관광 명소, 경복궁입니다! 흠잡을 데가 없어요!"
161079309,ko-KR,4.0,2019년 9월 21일,"생각보다 큰 것 같아요. 근처에서 한복 대여도 가능하고, 한복을 입으면 무료입장이에요. 그리고 주말에는 사람이 꽤 많으니 예쁜 사진을 많이 찍고 싶다면 평일에 가는 게 좋아요."
160664778,ko-KR,5.0,2019년 8월 28일,"환상적인 한복 체험이었어요!

모두들 꼭 한번 방문해 보세요!

근처에 지하 쇼핑몰도 많아요.

그리고 Trip.com 앱을 이용해서 항공권을 예약하는 걸 강력 추천합니다. Trip.com에서 멋진 여행 상품을 찾아보세요!"
163231189,ko-KR,5.0,2020년 4월 13일,"조선시대의 정궁이자 서울 5대 궁궐 중 가장 중요한 궁궐입니다. 한복을 입으면 무료 입장! 한복을 입으면 무료 입장! 한복을 입으면 무료 입장! 지하철 3호선 경복궁역 5번 출구에서 도보 5분 거리에 위치한 이곳은 1395년에 건립된 조선시대 정궁입니다. 전체 면적은 중국의 자금성보다 훨씬 작지만, 주요 명소들은 대부분 직선 코스로 둘러볼 수 있습니다."
162472081,ko-KR,4.0,2019년 12월 29일,"우리는 청와대 맞은편에 있는 신무문을 통해 경복궁에 들어갔습니다. 경복궁은 한국 역사상 마지막 통일 ​​왕조의 정궁이자 서울의 5대 궁궐 중 가장 중요한 궁궐이었으며 조선 초기의 정치적 중심지였습니다. 베이징의 자금성과 비슷하지만 규모는 더 작습니다. 성인 티켓은 1인당 3000원입니다. 경복궁의 정문인 광화문을 통해 입장하여 수문장 교대식을 관람하는 것을 추천합니다. 수문장 교대식은 매일 10:00, 13:00, 15:00, 16:00에 진행되며 출정식만 거행됩니다. 저희처럼 청와대를 먼저 방문한 경우 신무문을 통해 입장할 수 있습니다. 하지만 신무문은 약간 외진 느낌이 들고 광화문만큼 활기가 없습니다. 또한 경복궁은 매주 화요일에 문을 닫습니다."
160931375,ko-KR,5.0,2019년 9월 15일,"티켓 가격은 상당히 합리적입니다. 경복궁에 대한 소개를 듣고 싶으시다면, 매일 오전 10시 30분, 12시 30분, 오후 2시, 그리고 오후 4시에 1시간에서 1시간 30분까지 중국어 오디오 투어가 제공됩니다. 만남의 장소는 흥례문 안쪽, 경복궁 서비스센터 앞입니다. 경복궁은 직사각형 모양입니다. 광화문에서 뒤쪽 향원정까지 천천히 걸어가면 약 1시간에서 1시간 30분 정도 소요됩니다. 사진 촬영을 좋아하시는 분들은 최소 2시간 정도 시간을 잡으시는 것이 좋습니다."
160680867,ko-KR,5.0,2019년 8월 29일,"서울 청와대에 위치한 경복궁은 한국의 주요 관광 명소입니다. 한국 역사를 집약적으로 보여주는 경복궁은 역사의 정치 중심지를 상징하는 반면, 청와대는 오늘날의 정치 중심지를 상징합니다.

【명소】 이 명소는 오늘날 한국에서 가장 의례적인 문 중 하나인 광화문에서 시작하며, 근정전과 사정전을 포함한 여러 구역으로 구성되어 있습니다. 조선 시대 궁궐로, 그 규모와 높이는 중국 선양의 자금성과 비슷합니다. 한족 문화가 곳곳에 스며들어 있으며, 문지기와 경비병부터 궁궐의 배치까지 모든 것이 명나라 양식을 반영하고 있어 역사적 깊이로 인해 &quot;소중국&quot;이라는 별명을 얻었습니다. 수문장 교대식은 가장 의례적인 행사로, 전통적인 조선 군복을 입은 장군과 병사들이 많은 관심을 끌고 있습니다. 중요한 외교 환영식에서 어떤 사람들은 이 복장이 명나라 군대의 복제품이라고 지적하기도 하고, 심지어 명나라 오색 군기를 발견하기도 했습니다! 마찬가지로 궁궐 문 앞에 서 있는 문지기와 경비병들도 인기 있는 사진 명소입니다!

경복궁은 고대부터 현대까지 한국의 극적인 변화를 목격했습니다. 끊임없는 변화와 파괴를 겪으며 결국 일본 침략군에 의해 파괴되었습니다. 오늘날 경복궁은 완벽하게 복원된 복제품입니다. 과거의 영광을 기리기 위해 입구에 전시된 전통 한복은 중요한 문화 수출품입니다. 전통 한복을 입으면 경복궁에 무료로 입장할 수 있다고 하지만, 실제로는 세련되고 생동감 넘치는 변형된 모습으로 현대적인 감각을 더했습니다.

한국은 제국보다는 왕국 시대였기 때문에 경복궁은 특별히 크지 않습니다. 날씨가 좋으면 광화문에서 매일 수문장 교대식이 열리는데, 수문장들은 훌륭한 사진 촬영 장소입니다.

근정전은 경복궁의 심장이자, 가장 큰 건물이자 왕조의 중심지입니다. 경복궁 앞에 돌바닥이 깔린 유일한 곳이며, 그 아래에는 동쪽에는 문관, 서쪽에는 무관이 9열로 배치된 등석이 있습니다. 2품 이상의 관리들은 비를 피할 수 있었지만, 다른 관리들은 비를 견뎌야 했다고 전해집니다. 경복궁 앞에 있는 유일한 철제 고리는 위안스카이가 말을 매어 알현을 하던 곳이라고 합니다.

근정전 뒤편에 위치한 사정전은 규모가 더 작습니다. 이곳에 도착하면 경복궁의 위치가 바로 드러납니다. 작은 규모임이 분명합니다. 돌바닥은 사라지고 황토와 모래로 채워져 있습니다. 처음에는 옛 모습을 그대로 복원한다는 원칙에 어긋나는 조잡한 건축물처럼 보였습니다. 그러나 안내원은 조선 왕조의 이러한 배치는 암살 시도를 막기 위한 것이라고 설명했습니다. 황토와 모래 속으로 들어오는 자객은 소리를 내어 경비병들을 재빨리 경계했습니다.

게다가 조선 왕궁에는 원시적인 바닥 난방을 포함한 독특한 난방 시스템이 있었습니다. 궁궐의 침실에는 바닥 난방이 설치되어 있었고, 궁궐에는 장작을 태우는 굴뚝이 있었습니다. 왕은 바닥에서 잠을 자야 했기 때문에 바닥 난방이 하나의 해결책이 되었고, 이는 역사적인 특징이 되었습니다."
163232238,ko-KR,5.0,2020년 4월 13일,"경복궁 근처에는 한복을 대여하는 가게가 많습니다. 여성분들은 한복을 빌려 사진 촬영을 할 수 있고, 무료 입장도 가능합니다. 경복궁은 한국의 랜드마크입니다. 근처에 한복을 대여할 수 있는 곳이 여러 곳 있는데, 가격도 다양하고 남녀노소 모두에게 인기가 많습니다. 한복을 입으면 무료 입장이 가능하기 때문이죠! 경복궁은 사실 꽤 작습니다."
163229452,ko-KR,5.0,2020년 4월 13일,"한국 사극의 분위기를 직접 느껴보고 싶으신가요? 그렇다면 경복궁을 꼭 방문해 보세요. 늦가을이나 초겨울에는 앙상한 나무들과 멀리 보이는 산들이 궁궐의 위엄을 더욱 돋보이게 합니다. 한복(전통 한복)을 입어야 입장이 가능하기 때문에, 안에는 한복을 입은 관광객들이 많이 있습니다."
163231454,ko-KR,5.0,2020년 4월 13일,"경복궁은 명나라 태조 황제 재위 당시와 비슷한 시기에 지어졌으며, 처마와 채색된 기둥은 명나라 양식을 그대로 간직하고 있습니다. 한복을 입고 있기 때문에 경복궁 입장은 무료입니다. 티켓을 구매할 필요 없이 그냥 거닐어 들어갈 수 있습니다. 하지만 그날은 날씨가 여전히 너무 추워서 비가 오지 않기를 기도했습니다."
171725780,ko-KR,4.0,2022년 7월 24일,"경복궁은 서울에서 꼭 방문해야 할 명소입니다. 한반도 역사상 마지막 통일 왕조였던 조선(이씨 왕조)의 정궁(법궁)입니다. 서울특별시 종로구 사직로 161에 위치한 경복궁은 서울의 북쪽에 위치하여 &#39;북궁&#39;이라고도 불립니다. 서울의 5대 궁궐 중 첫 번째 궁궐이자 조선 초기 정치의 중심지였습니다. 경복궁 문 밖에서는 의상 공연과 다양한 체험 행사가 열립니다. 한복을 입으면 무료 입장이 가능하여 한복을 입은 사람들이 많고, 근처에는 한복을 대여하는 가게도 많습니다."
170735921,ko-KR,5.0,2022년 5월 21일,"경복궁은 서울을 방문하는 모든 관광객에게 꼭 가봐야 할 곳입니다. 설령 가보지 않았더라도 시대극을 본 사람이라면 어느 정도 기억에 남을 것입니다.

경복궁은 한국 역사상 마지막 통일 ​​왕조(조선)의 정궁입니다. 서울 종로구 사직로 161에 위치한 경복궁은 서울 북쪽에 위치하여 &#39;북관(北館)&#39;이라고도 불립니다. 서울의 5대 궁궐 중 으뜸가는 궁궐이자 조선 초기 정치의 중심지였습니다.

경복궁은 1395년(명나라 홍무 28년)에 건립되었습니다. 경복궁이라는 이름은 시경에 나오는 &#39;경복(景福)&#39;이라는 구절, 특히 &quot;선비(善僧)는 무량(無量)한 복(福)을 누리기를&quot;에서 유래했습니다. 궁궐의 규모와 배치는 종주국인 중국과의 조공 관계를 엄격히 준수했으며, 명나라 왕가의 거처 규정에 따라 지어진 왕가의 거처였습니다. 모든 건물은 중국 황궁의 노란색과 구별하기 위해 주홍색으로 칠해졌습니다. 12만 6천 평(약 6,667㎡)의 면적에 정사각형 형태입니다. 정문인 광화문은 남쪽에, 건춘문은 동쪽에, 영추문은 서쪽에, 신무문은 북쪽에 있습니다.

경복궁에는 근정전이 있습니다. 궁궐과 누각에는 사정전, 강녕전, 교태전, 자경전, 경회루, 향원정이 있습니다. 정전인 근정전은 고대 한국에서 가장 크고 웅장한 목조 건물로, 공식적인 의례를 치르고 조정에서 신하들을 접견하는 정전 역할을 했습니다.

팁: 흥례문 광장에서는 매일 두 번씩 수문장 교대식이 열립니다. 교대식 후에는 수문장들과 함께 사진을 찍을 수 있습니다."
168126851,ko-KR,5.0,2021년 10월 26일,"경복궁(景福宮, 한글: 경복궁)은 한반도 역사상 마지막 통일 ​​왕조였던 조선(이나라)의 정궁(혹은 왕궁)입니다. 조선의 수도였던 한양(지금의 서울)에 위치한 경복궁은 서울의 북쪽에 위치하여 북궁(北宮)이라고도 불립니다. 서울의 5대 궁궐 중 가장 중요한 궁궐이자 조선 초기 정치의 중심지였습니다."
165718875,ko-KR,5.0,2021년 2월 12일,한국의 자금성으로 불리는 경복궁은 서울 번화가 한구석에 자리 잡고 있습니다. 600년이 넘는 역사를 자랑하는 경복궁은 시경의 &quot;선덕한 자는 만년을 살고 복이 많기를&quot;이라는 구절에서 유래했습니다. &quot;대장금&quot;과 &quot;별에서 온 그대&quot; 등 수많은 인기 드라마의 촬영지로도 유명하여 한국 드라마 팬이라면 꼭 방문해야 할 명소입니다.
164928023,ko-KR,5.0,2020년 10월 29일,"가을/겨울에 혼자 한국에 갔었는데 😂 경복궁에 우연히 들렀어요. 거기서 오후를 보냈죠. 햇살이 따뜻했고, 경복궁은 한복을 입은 사람들로 가득했어요. 현지인과 관광객 모두였죠. 풍경이 아름다웠어요 (아마 제가 편안한 분위기였기 때문일 거예요). 그리고 수문장 공연도 봤어요 (이름이 그랬던 것 같은데, 확실하진 않아요 😂). 다음에는 친구, 특히 절친과 함께 가서 아름다운 한복을 입고 한국 드라마에 나오는 궁궐 분위기를 느껴보고 싶어요."
162791562,ko-KR,5.0,2020년 2월 4일,"경복궁은 서울에서 가장 크고 오래된 궁궐 중 하나로, 한국 봉건 사회 후기 정치의 중심지 역할을 했습니다. 1561년(선조 20년) 임진왜란 당시 궁궐 건물 대부분이 소실되어 10개의 궁궐만 남았습니다. 1868년(고종 7년)에 이르러서야 고종의 아버지인 흥선대원군의 주관으로 중건되었습니다."
161707992,ko-KR,5.0,2019년 10월 25일,"꽤 넓어서 여유롭게 산책하고 사진 찍으면 두 시간 정도 걸릴 것 같아요. 경복궁 앞에서 대선이 치러져서 대형 스크린으로 연설을 들으러 온 인파가 엄청 많았고, 교통 체증이 엄청났어요. 호텔에서 2km 정도 떨어져 있어야 할 거리가 20분 넘게 걸렸어요. 광화문에서 투어를 시작하는 게 제일 좋은 곳이라고 하지만, 저희는 기사님이 서문으로 안내해 주셨어요. 사실 서문에서 바로 북촌 한옥마을에 갈 수도 있지만, 저희는 동문으로 나왔어요. 바로 건너편에 유명한 토속 삼계탕이 있거든요."
194950946,ko-KR,4.0,2024년 10월 11일,"경복궁의 야경, 특히 연못 속 2층 건물은 조명 장식 아래 더욱 아름답습니다. 제가 찍은 사진보다 실물이 훨씬 더 아름답습니다. 관심 있는 분들은 꼭 한번 가보세요."
163230099,ko-KR,5.0,2020년 4월 13일,"경복궁은 연중 무료 중국어 가이드 투어를 제공합니다. 일정은 온라인에서 확인하실 수 있습니다. 투어는 정말 훌륭합니다! 경복궁 부지는 꽤 넓은데, 지방 정부가 지속적으로 복원하고 있어 매년 새로운 개발이 진행되면서 계속 확장될 것입니다."
196946226,ko-KR,5.0,2024년 11월 7일,"경복궁은 유구한 역사를 자랑합니다! 서울의 5대 궁궐 중 가장 웅장하며 웅장한 건축미를 자랑합니다.

궁궐 내부를 둘러보고 고대 한국의 궁궐 문화에 대해 알아볼 수 있습니다.

전통 공연과 전시도 즐길 수 있습니다.

한국의 전통 문화를 체험하기에 좋은 곳입니다."
163232286,ko-KR,5.0,2020년 4월 13일,광화문은 경복궁의 정문입니다. 조선 시대 황제들의 거처였던 광화문의 규모는 웅장한 천안문 광장과는 비교할 수 없습니다. 건축물을 감상하고 박물관을 방문하여 역사를 배우는 것 외에도 한복을 입고 사진을 찍거나 공연을 관람할 수 있습니다. 반나절이면 충분히 둘러볼 수 있습니다.
173428239,ko-KR,5.0,2022년 11월 2일,"꿈이 이루어졌어요!!😭✨ 2019년에 처음 한복을 입어봤어요. 코로나 전 마지막 여행이었죠. 실제 한복은 드라마에서 봤던 것보다 훨씬 아름다웠지만, 그날은 정말 추웠어요. 안에 열선을 썼는데도 손이 얼얼하고 입이 떨렸어요. ㅎㅎㅎ 그래도 친구들과 함께 한복에 푹 빠져서 추위는 잊고 두 시간 가까이 사진 찍으며 돌아다녔어요. 작은 퍼레이드도 봤어요. 입구 경비를 서던 직원들이 마침 교대 근무를 하고 있었거든요. 정말 인상적이었어요💖👍🏻"
169921637,ko-KR,5.0,2022년 3월 18일,"투어는 가장 크고 웅장한 광화문에서 시작하여 중앙 축을 따라 진행됩니다. 세 개의 문을 지나면 궁궐의 심장인 근정전에 도착합니다. 경복궁의 정전이자 고대 한국에서 가장 크고 웅장한 목조 건축물입니다. 근정전은 공식적인 의례를 치르고 궁궐 관리들의 인사를 받는 주요 장소였기 때문에 관광객들에게 가장 인기 있는 장소입니다. 더 나아가면 왕의 거처가 있습니다. 얼어붙은 연못 옆에는 접견실인 경회루가 있습니다. 뒷마당에는 고대 궁궐의 난방 방식을 보여주는 전시물이 있는데, 건물 전체에 바닥 난방이 설치되어 있었습니다. 신발을 벗고 안으로 들어가 고대 바닥 난방을 체험해 보았습니다. 방이 조금 작았지만 정말 좋았습니다. 궁궐 건축의 전반적인 색 구성은 자금성과 유사하며 중국 문화의 영향을 받은 것으로 보입니다. 투어는 약 2시간 정도 소요되며, 근처에 방문할 만한 박물관 두 곳이 있습니다. 놓치지 마세요!"
162493593,ko-KR,4.0,2019년 12월 31일,"이 지역은 69만 제곱미터가 넘는 광활한 면적을 자랑합니다. 수 세기 동안 이어져 온 유서 깊은 유적지이며, 후손들이 이 역사적인 유물을 직접 볼 수 있도록 여러 단계에 걸쳐 복원 공사가 진행되었지만 아직 완전히 완공된 것은 아닙니다. 하지만 수많은 궁궐 건물들을 보는 것만으로도 과거의 영광을 상상할 수 있습니다.

겨울에 한복을 입고 경복궁을 거니는 것은 정말 특별한 경험이었습니다. 마치 그 시대에 살고 있는 것 같았습니다. 궁궐 구석구석을 돌아다녔습니다. 그 후에는 한국의 전통 생활상을 보여주고 약 4,000점의 관련 유물을 전시하는 국립민속박물관을 방문했습니다."
160940177,ko-KR,5.0,2019년 9월 15일,경복궁은 꼭 방문해야 할 명소 중 하나입니다. 한복을 입으면 무료로 입장할 수 있습니다. 사진 촬영 장소가 많고 공간도 꽤 넓어서 모든 장소에서 사진을 찍으면 나오는 데 몇 시간이 걸릴 수도 있습니다. 경복궁 정문 왼쪽에는 방문객들이 소지품을 보관할 수 있는 무료 사물함이 있습니다.
163232412,ko-KR,5.0,2020년 4월 13일,경복궁은 정말 작아요. 한 시간이면 다 볼 수 있을 만큼 작아요. 자금성과 비교하기도 힘들 정도로 작아요. 베이징의 어떤 황궁보다도 규모가 훨씬 작거든요. 오디오 가이드는 정말 실망스러웠어요. 전혀 아깝지 않았어요. 차라리 투어 가이드를 따라갔으면 더 좋았을 텐데요.
162808875,ko-KR,4.0,2020년 2월 8일,"경복궁의 아름다운 환경, 각 건물은 한국의 특성으로 가득 차 있어서 마치 고대에 있는 것 같은 느낌이 들었습니다. 한복을 입으면 한국 드라마를 촬영하는 것 같은 느낌이 들었어요. 정말 흥미롭고 신선했습니다!"
163229635,ko-KR,5.0,2020년 4월 13일,"어떤 사람들은 경복궁이 자금성의 축소판이라고 말하는데, 한때 서울에서 가장 중요한 궁궐 중 하나였습니다. 여행 전에 어머니께 경복궁에 오시면 한복을 입으시면 아주 특별한 경험이 될 거라고 설득해 보려고 했습니다. 하지만 어머니께서 추위를 무서워하셔서 설득할 수가 없었습니다."
196374879,ko-KR,5.0,2024년 10월 28일,"경복궁은 풍부한 역사와 웅장한 건축 양식을 자랑합니다.

전통적인 한국 양식과 엄숙하고 장엄한 분위기를 자랑합니다. 경복궁의 주요 볼거리는 고궁 건축 양식과 풍부한 문화 전시입니다.

경복궁은 한국의 역사와 문화를 배우는 데 매우 중요한 장소입니다."
162643692,ko-KR,5.0,2020년 1월 15일,"놀랍게도 자금성 순례를 떠나기도 전에 경복궁을 먼저 방문했습니다. 드라마에서 봤던 한국의 궁궐들은 항상 초라하고 허름해 보였는데, 경복궁은 제가 상상했던 것보다 훨씬 웅장해서 방문할 가치가 충분했습니다."
174032612,ko-KR,4.0,2022년 12월 8일,"서울의 두 대궁 중 하나인 경복궁에서 한복을 입고 사진을 찍으려면 미리 한복을 차려입는 것이 좋습니다. 한복을 입으면 티켓을 따로 구매할 필요가 없으니까요! 정문에서는 하루에 여러 번 다양한 공연이 펼쳐지는데, 짧지만 볼 만한 가치가 있습니다. 안으로 들어가면 기본적으로 외부 사진만 찍을 수 있고, 한국에서는 일반적으로 방 안으로 들어갈 수 없습니다!"
166075667,ko-KR,5.0,2021년 3월 29일,"한반도 역사상 마지막 통일 ​​왕조였던 조선(이나라)의 정궁입니다. 조선의 수도였던 한양(현재의 서울)에 위치한 이곳은 서울의 5대 궁궐 중 가장 중요한 궁궐입니다.

건물 배치나 건물 규모가 조금 더 작기 때문에 자금성보다 훨씬 작게 느껴지지만, 실제 면적은 자금성보다 약 20% 정도 작습니다. 시간을 내어 탐험하고 자세히 알아보는 것은 꽤 흥미로운 일입니다."
165158387,ko-KR,5.0,2020년 11월 25일,"문 닫을 시간이 다 되어가는데도 문 바로 안쪽 광장은 여전히 ​​관광객들로 북적였습니다. 경복궁은 베이징에 있는 자금성에 비하면 정말 작지만, 그 매력은 소박함에 있습니다. 자금성의 웅장함은 엄숙함을 풍기는 반면, 경복궁의 소박함은 더 따뜻하고 소박한 느낌을 줍니다. 아쉽게도 저는 한국 역사에 대해 아는 것이 거의 없고, 한국 드라마도 거의 본 적이 없어서 경복궁 방문은 순전히 재미로 했습니다. 경복궁은 자금성보다 훨씬 작고, 누각과 건물들도 그다지 높지 않아 왕실의 경외감을 불러일으키는 존재감이 부족합니다. 그리고 이곳의 몇몇 건물들은 마치 화장실처럼 뒤편이 되어 있습니다!"
164453871,ko-KR,5.0,2020년 9월 16일,"경복궁은 1395년(홍무제 28년)에 처음 건립되었으며, 여러 차례 소실과 중건을 거쳤습니다. 경복궁이라는 이름은 시경에 나오는 &quot;경복궁(慶福宮)&quot;이라는 구절, 특히 &quot;덕이 있는 군주에게 무궁한 복을 누리게 하소서(慧君之守)&quot;에서 유래했습니다. 경복궁의 규모와 배치는 종주국인 중국과의 조공 관계를 엄격히 준수하여 명나라의 왕궁 규정에 따라 지어진 왕궁이었습니다. 모든 건물은 중국 황궁의 노란색과 구별하기 위해 주홍색으로 칠해졌습니다. 12만 6천 평(57.75헥타르)에 달하는 경복궁은 정사각형으로, 남쪽에는 정문인 광화문, 동쪽에는 건춘문, 서쪽에는 영추문, 북쪽에는 신무문이 있습니다."
163230047,ko-KR,5.0,2020년 4월 13일,"경복궁은 정말 아름다웠고, 한복을 입은 젊은 여성분들이 많았어요. 아쉽게도 제가 갔을 때는 한복을 빌려야 한다는 걸 몰랐는데, 한복을 입으면 입장료가 무료예요! 무료 중국어 가이드 투어에 꼭 참여하세요. 정말 유익해요!"
163226201,ko-KR,5.0,2020년 4월 12일,경복궁은 조선 500년 역사 중 200년 동안 정궁으로 기능했습니다. 문을 지키는 수문장들은 여전히 ​​전통 의상을 입고 있어 마치 시간 여행을 하는 듯한 느낌을 주었습니다. 경복궁의 역사와 문화를 더 깊이 경험하기 위해 저는 여행 전에 온라인으로 한복 체험을 예약했습니다.
