reviewId,language,rating,date,content
11946030,ko-KR,5.0,2013년 11월 19일,"궁궐 단지는 규모는 작지만 우아합니다. 지난 7월에 다시 수도를 방문했을 때, 첫인상은 &#39;규모가 작다&#39;는 것이었습니다. 본래의 황실 분위기가 부족해 보였습니다. &#39;세련된 여인&#39;이라는 표현은 너무 여성스러울 것 같았습니다. 그래서 &#39;우아하다&#39;라는 말이 가장 적절하다고 생각했습니다. 경복궁을 방문하고 난 후 든 생각은 &#39;조선 왕보다는 천하의 신하가 되고 싶다&#39;는 것이었습니다."
181889165,ko-KR,5.0,2024년 5월 19일,한국을 제대로 경험하려면 여기가 필수예요! 한복도 대여할 수 있고요. 경치가 정말 아름다워서 사진 찍기에도 완벽한 곳이에요. 계절마다 풍경이 바뀌니 더욱 특별한 경험을 할 수 있을 거예요! 👍👍👍
175439870,ko-KR,5.0,2023년 4월 8일,문을 숨기면 공기가 다르다고 생각합니다. 파워 스팟입니다 😊 시기에 따라 입장 가능한 장소와 라이트 업이 있으므로 몇 번 방문해도 신선함이있어 만족도가 높습니다 ✨
74789589,ko-KR,4.0,2016년 6월 24일,한국에 처음 방문하는 사람이라면 한국 역사를 배울 수 있는 좋은 곳이니 꼭 한번 가볼 만합니다! 하지만 중국의 자금성과는 비교할 수 없죠!
179535783,ko-KR,5.0,2023년 10월 26일,"치마초고리를 대여해 가면 무료로 넣었습니다!
사진을 찍는 것이 메인이었지만 멋진 추억이 되었습니다 😍✨"
162077334,ko-KR,5.0,2019년 11월 23일,"근처에서 한복(전통 한국 의상)을 대여할 수 있고, 거의 모든 가게에 중국어가 가능한 직원이 있어요! 한복을 입으면 궁궐에 무료로 입장할 수 있답니다.

사진을 찍을 때마다 마치 한국 드라마 속에 있는 듯한 기분을 느낄 수 있을 거예요. 정말 아름다운 풍경이거든요! 기분 전환에도 최고랍니다!

친구들이나 가족과 함께 멋진 사진을 찍으며 즐거운 여행을 떠나기에 완벽한 곳이에요!"
215954908,ko-KR,5.0,2025년 7월 4일,한복을 완벽하게 경험해 보세요! 한복 착용 시 입장료는 무료입니다.
180357808,ko-KR,5.0,2024년 1월 10일,"서울 도심에 위치한, 꼭 방문해야 할 궁궐."
179853773,ko-KR,5.0,2023년 11월 20일,"去年のキョンボックンです！
空がとってもキレイです^ ^
경복궁 가을에 가는게 가장 예쁘고 분위기도 되게 좋은고 같아요!"
172860582,ko-KR,5.0,2022년 9월 28일,"경복궁
한국 전통 문화를 체험할 수 있는 곳
한복을 입고 아름다운 풍경을 감상하며 사진을 찍을 수 있어 마치 시간 여행을 떠난 듯한 기분을 느낄 수 있습니다 🥰"
711204817,ko-KR,5.0,5월 30일,취향과 색상에 맞는 다양한 한복이 준비되어 있었어요. 친절하고 상냥한 직원분들 덕분에 딱 맞는 한복을 찾을 수 있었어요.🥰
179879438,ko-KR,5.0,2023년 11월 25일,서울의 가장 유명한 관광지라고 생각합니다. 우선 가는 것이 좋을 것 같다.
178837667,ko-KR,5.0,2023년 9월 5일,"많은 사람들이 경복궁에 갈 때 한복을 빌려 입는데, 한복을 입기에 완벽한 장소인 것 같아요! 6월이라 날씨도 너무 덥거나 습하지 않았습니다. 궁궐 규모가 꽤 커서 사진 찍을 만한 곳이 많았어요. 한국 드라마를 본 사람이라면 누구나 익숙한 장면들이 많았을 거예요!"
177190252,ko-KR,5.0,2023년 6월 28일,"서울에 오시면 꼭 아름다운 한복을 입고 경복궁에서 멋진 사진을 찍어보세요.
다른 나라에서 온 다양한 피부색의 사람들이 한복을 입은 모습도 볼 수 있는데, 정말 흥미로워요. 자외선 차단제 꼭 바르세요. 금방 타버릴 거예요 🙆🏾&zwj;♀️"
162719371,ko-KR,5.0,2020년 1월 23일,"모든 나라에는 자국민이 자긍심을 느끼는 문명이 있습니다. 중국인으로서 자금성을 보고 나니 자금성과 경복궁의 차이가 확연히 느껴졌고, 중국인이라는 사실이 자랑스러웠습니다."
180506224,ko-KR,4.0,2024년 1월 25일,"경복궁, 서울 🇰🇷

날씨가 굉장히 추웠어요 🥶. 한복을 두 시간 동안 대여했으니 추위에 대비하시는 게 좋을 것 같아요.

한복을 입고 경복궁에 입장하는 것은 무료입니다.

저는 오후 3시 45분쯤, 꽤 늦게 도착했어요.

입장 마감 시간은 오후 4시이지만, 궁궐은 오후 5시에 폐장하니 참고하세요."
178133677,ko-KR,5.0,2023년 8월 4일,경복궁은 해질녘부터 밤까지 꼭 방문해보세요. 시간대에 따라 아름다움이 달라집니다😍
175730437,ko-KR,5.0,2023년 5월 4일,"한복을 입고 있으면 경복궁에 무료로 입장할 수 있지만, 그렇지 않으면 입장권을 구매해야 합니다. 매표소에 줄이 너무 길어서 입장 전에 한복 가게에 가서 한복으로 갈아입었습니다. 궁궐 안에는 한복을 입은 사람들이 훨씬 많아서 마치 고대 궁궐에 온 듯한 느낌이 들었습니다."
160686505,ko-KR,5.0,2019년 8월 30일,이곳은 영화 촬영에 정말 좋은 곳이에요. 모든 장면이 멋진 매력을 지니고 있어요! 정말 최고예요! 옛 한국의 삶을 체험할 수 있어서 너무 좋았습니다!
193021781,ko-KR,5.0,2024년 9월 18일,경비대 교대식을 우연히 보게 되었어요
175827365,ko-KR,4.0,2023년 5월 13일,"이번이 경복궁에 세 번째 방문인데, 환경이 여전히 아주 깨끗해요. 한복을 입으면 무료로 입장할 수 있어서 많은 관광객들이 한복을 입고 들어가는데, 분위기가 정말 좋아요!"
171620128,ko-KR,4.0,2022년 7월 19일,"궁전은 정말 아름다웠지만, 제가 여름에 갔을 때는 날씨가 너무 덥고 햇볕이 강했습니다. 겨울에 오는 것이 훨씬 좋을 것 같습니다."
169047411,ko-KR,5.0,2022년 1월 7일,경복궁은 영국을 처음 방문하는 사람이라면 꼭 가봐야 할 곳입니다. 규모는 꽤 크지만 자금성만큼 크지는 않습니다. 사진 촬영 기술이 좋다면 멋진 사진을 많이 찍을 수 있습니다.
162833810,ko-KR,4.0,2020년 2월 12일,"한복을 입고 경복궁을 방문하는 것은 외국인 관광객들이 한국 한복 체험을 하는 특징 중 하나입니다. 경복궁은 규모가 상당히 크지만, 누각과 정자를 제외하면 다른 볼거리는 없습니다."
160061363,ko-KR,5.0,2019년 8월 2일,"씨트립 오디오 가이드를 따라 각 관광지를 둘러보니 정말 편리하고 재미있었어요. 경복궁은 규모가 크지는 않지만 실제로 매우 아름답고, 입장료도 저렴했습니다!"
74684554,ko-KR,5.0,2016년 6월 17일,"경복궁은 한국의 왕궁입니다. 웅장한 건축미는 한국인의 지혜를 보여주며, 방문할 가치가 충분합니다."
172555559,ko-KR,5.0,2022년 9월 7일,"광화문의 상징인 경복궁,,경복궁의 봄여름가을겨울 사계절을 봤는데유독 이뻣던 날의 경복궁 사진 올려봅니다🫶"
175047504,ko-KR,4.0,2023년 2월 28일,"지하철을 타면 경복궁 입구(경복궁역, 5번 출구)까지 바로 갈 수 있어서 정말 편리해요. 규모는 크지 않지만 나름의 매력이 있어요. 근처에 한복 대여점도 있어서 한복을 입고 사진 찍기에도 좋은 곳이에요 ❤️"
11939234,ko-KR,5.0,2014년 5월 20일,"경복궁은 조선 시대(1392~1910) 서울(옛 한양)에 있던 다섯 개의 주요 궁궐 중 하나이며, 조선 왕조의 중심 궁궐이었습니다. 11월이라 단풍은 이미 지나가고 앙상한 나뭇가지들이 바람에 흔들리고 있었지만, 오히려 그것이 고풍스러운 매력을 더해 마치 조선 시대로 시간 여행을 온 듯한 느낌을 자아냈습니다."
193427348,ko-KR,5.0,2024년 9월 23일,"7월에 치마초고리를 입고 갔습니다만, 약간 더워 걷는 것이 힘들었습니다."
164726332,ko-KR,5.0,2020년 10월 9일,"한국의 역사를 느낄 수 있는 장소♪
초고리를 온 관광객의 사람도 많이 풍정이 있다♪
액세스도 잘 방문하기 쉬운 ♪"
162943618,ko-KR,5.0,2020년 3월 3일,"서울 여행 시 꼭 방문해야 할 곳 중 하나입니다. 먹고 마시고 즐기기에 더할 나위 없이 좋은 곳이죠. 한국은 작은 나라이지만, 먹을거리와 살거리가 정말 많습니다."
162880353,ko-KR,4.0,2020년 2월 21일,"경복궁은 주로 초록색과 주홍색으로 이루어져 있어 소박한 느낌을 줍니다. 지나가던 한 동포에 따르면, 내부는 기본적으로 거대한 다다미방이며, 외부 길은 자금성의 청석과는 달리 모두 자갈로 되어 있다고 합니다."
162831279,ko-KR,5.0,2020년 2월 12일,한복을 처음 입어보니 정말 신기했어요. 기모노보다 훨씬 편했고요. 날씨도 정말 좋았어요.
178862340,ko-KR,4.0,2023년 9월 7일,"서울 중심부에 위치한 경복궁은 오늘 방문하지 못했으니, 다음에 기회가 되면 가보도록 하겠습니다."
175564617,ko-KR,5.0,2023년 4월 20일,"간단히 말해서, 한복을 빌려 입으면 경복궁에 무료로 입장하여 관람하고 사진을 찍을 수 있습니다. 경복궁 곳곳에서 한복을 입은 관광객들을 볼 수 있으니 어색하거나 이상하게 생각하지 마세요. 꼭 한번 시도해 볼 만한 가치가 있습니다!"
162512838,ko-KR,5.0,2020년 1월 2일,정통 한복을 처음 입어본 경험은 잊을 수 없는 경험이었습니다. 현지인들의 따뜻한 환대와 꼼꼼한 설명 덕분에 정말 소중한 추억으로 남았습니다.
689554440,ko-KR,5.0,5월 6일,가격도 저렴하고 산책하기 좋은 아름다운 공원이에요! 특히 날씨 좋을 때 가보시면 꼭 추천합니다.
178568751,ko-KR,5.0,2023년 8월 24일,"도시 속에 갑자기 나타나는 왕궁이 매력적.
색다른 한국을 즐길 수 있는 명소!
수문 장교대식의 퍼포먼스도 볼 수 있어, 하루 종일 즐길 수 있습니다!"
201245360,ko-KR,4.0,2025년 1월 7일,"네, 그런데 안에 사람이 너무 많아서 머리 손질할 시간이 없었어요. 한복은 정말 소박해요. 처음 가시는 분들은 고급스러운 한복을 고르시는 걸 추천드려요✅"
178612824,ko-KR,4.0,2023년 8월 27일,"관광객이 많이 있습니다! 시간에 따라 교체식을 볼 수도 있습니다. 부지내가 넓기 때문에, 차분히 보는 사람은 긴 시간을 생각해 주세요!"
175431129,ko-KR,5.0,2023년 4월 7일,"서울에서 가장 유명한 관광 명소 중 하나인 이곳은 주변에 한복 대여점이 많습니다. 공원 규모가 크고 궁궐과 건물들이 많아 여유롭게 둘러보는 것이 좋으며, 최소 반나절은 할애하는 것을 추천합니다."
165067684,ko-KR,5.0,2020년 11월 14일,"베이징 자금성에 있는 축소판 궁궐처럼, 정확히 말하자면, 모두 우리 궁궐을 본떠 만든 것이지만, 건물들이 훨씬 더 낮습니다."
162187668,ko-KR,5.0,2019년 12월 3일,"경복궁에 가실 때는 꼭 한복을 입어보세요. 정말 아름다워요. 마치 타임머신 드라마의 한 장면 같아요, 하하하."
160473172,ko-KR,5.0,2019년 8월 19일,"저희 투어 가이드이신 장 선생님은 정말 친절하셨어요! 아이들과 함께 여행해서 천천히 걸었는데도 선생님은 patiently 기다려주셨어요! 또한, 꼼꼼하고 전문적이셔서 각 관광지에 대해 자세하게 설명해주셨어요! 정말 감사드려요! 최근 몇 년 동안 만난 몇 안 되는 훌륭한 투어 가이드 중 한 분이셨어요! 최고예요!"
180152839,ko-KR,5.0,2023년 12월 24일,"경복궁은 정말 아름다웠습니다. 그곳에서 한복을 입어본 것은 정말 멋진 경험이었고, 과거 한국 사람들의 생활 모습을 엿볼 수 있는 기회였습니다."
179620990,ko-KR,5.0,2023년 11월 1일,정말 아름다웠어요! 오늘 갔었는데 궁전이 닫혀 있어서 조금 실망했어요.😅
176016721,ko-KR,5.0,2023년 6월 1일,"입장료 300엔을 초고리를 입고 있으면 무료입니다.
트케비의 로케지이기도 해, bts도 퍼포먼스를 하고 있어, 감동했습니다."
173603440,ko-KR,5.0,2022년 11월 12일,너무 이쁘고 특히 한복을 꼭 입고 가보길 권유드려요!!
162940229,ko-KR,5.0,2020년 3월 3일,훌륭한 내레이션 덕분에 마치 현장에 있는 듯한 느낌을 받았습니다. 아름다운 내레이션이 돋보이는 여러 구절들을 통해 경복궁 특유의 민속문화적 매력을 느낄 수 있었습니다. 정말 멋진 경험이었어요. 씨트립에서 출시한 이 오디오 가이드 시리즈는 세계 각국의 대표적인 명소들을 소개하여 집에서 편안하게 세계여행을 즐길 수 있게 해주었습니다. 씨트립 덕분에 가능했던 일입니다.
162914170,ko-KR,4.0,2020년 2월 27일,"이 궁전은 매우 넓어서 그 자체가 공원이나 다름없고, 마치 왕실 정원처럼 웅장합니다. 화려한 건축 양식을 자랑하며, 내부에는 큰 연못이 있고 연못 위에는 정자들이 자리하고 있습니다. 분명 부유한 가문의 저택임이 분명합니다."
174063449,ko-KR,5.0,2022년 12월 10일,이곳은 한국에서 가장 잘 보존된 역사 유적지 중 하나로 여겨져야 합니다. 물론이죠...
164116092,ko-KR,5.0,2020년 8월 14일,"인생은 여정과 같습니다. 중요한 것은 목적지가 아니라, 그 길을 따라 펼쳐지는 풍경과 그 풍경을 바라보는 마음가짐입니다. 당신의 영혼이 여행하도록 내버려 두세요!"
164075267,ko-KR,5.0,2020년 8월 10일,"혼자 여행한다는 것은 일상적인 세부 사항은 무시하고, 도시와 이야기를 자유롭게 경험하며, 웃음의 흔적을 남기는 것을 의미합니다."
162395660,ko-KR,5.0,2019년 12월 24일,"색다른 문화를 탐험하고 한국 서울의 역사, 문화, 그리고 배경을 경험해 보세요. 정말 아름다운 서울에서 한복을 입으면 마치 시간 여행을 떠난 듯한 기분을 느낄 수 있을 거예요!"
682920526,ko-KR,4.0,4월 27일,"괜찮긴 한데, 근처에 다른 선택지가 많아요. 더 저렴하고 덜 붐비는 곳도 많고요."
675988272,ko-KR,4.0,4월 17일,정가에는 속치마를 제외한 전통 한복 세트가 포함되어 있습니다. 전체적으로 가격 대비 만족도가 높습니다. 가게는 입구 근처에 있어 찾아가기 쉽습니다.
211433314,ko-KR,4.0,2025년 5월 12일,"대부분의 건물은 나중에 보수되었지만, 여전히 방문할 가치가 있는 크고 독특한 한국 궁궐입니다. 3,000원의 입장료는 매우 저렴하며, 한복 착용은 무료입니다. 광화문에서는 수문장 교대식이 열리는데, 가장 붐비는 문이기 때문에 티켓 구매와 입장 모두 줄이 늘어서 있습니다. 광화문은 꽤 넓어서 꼼꼼히 둘러보려면 오후 내내 걸릴 것입니다. 근처와 내부의 박물관까지 더하면 하루 종일 둘러볼 수 있습니다."
175806774,ko-KR,5.0,2023년 5월 11일,"위병교대식을 추천합니다. 시간이 빠듯해도 잘 보입니다. 64세 이상으로, 치마초고리 착용의 분은 무료로 넣는 것 같습니다."
175596587,ko-KR,4.0,2023년 4월 23일,경복궁에 가시면 사진 촬영을 위해 반드시 한복을 입으셔야 합니다. 경복궁에는 사진을 찍을 수 있는 다양한 전각과 비석들이 있습니다 😉
173002780,ko-KR,5.0,2022년 10월 7일,"정말 좋았어요! 주변 쇼핑하기에도 아주 좋은 곳이에요.

한복을 빌려서 입고 돌아다녔어요!

삼청동 근처에는 아기자기한 가게들이 정말 많아요!"
168468680,ko-KR,5.0,2021년 11월 22일,"한국을 방문하는 관광객이라면 꼭 가봐야 할 곳입니다. 팬데믹 이전에는 중국인 관광객이 대부분이었어요. 규모는 크지 않지만, 그래도 한 번쯤 방문해 볼 만하다고 생각합니다."
74397172,ko-KR,4.0,2016년 5월 26일,"여기는 처음 와봤는데, 마치 우리 영화&middot;드라마 제작소처럼 작게 느껴지네요. 자금성처럼 웅장하진 않지만, 한국에 오면 꼭 가봐야 할 곳이에요."
74295437,ko-KR,5.0,2016년 5월 20일,"이곳은 중국의 자금성과 비슷하지만, 규모나 웅장함 면에서는 비교할 수 없습니다. 오전 10시에는 한국 전통 의상을 입은 수비대원들의 교대식이 있는데, 관람할 수 있습니다. 내부에 있는 민속박물관은 무료이며 방문할 가치가 있습니다."
74137262,ko-KR,4.0,2016년 4월 22일,"2호선을 타고 심장역에서 5정거장 가서 을지로3가역에서 내린 후, 3호선으로 갈아타고 3정거장 뒤 경복궁역에서 내리세요. 저는 9시 45분에 도착했는데, 마침 고복수호 교대식 공연이 있어서 좋았습니다. 입장료는 1인당 3,000원입니다. 내부는 그저 그렇고, 자금성에 비하면 볼거리가 적습니다. 가이드를 구하는 게 좋을 거예요. 안에 있는 사람들의 50% 이상이 중국 단체 관광객입니다.

삼계탕: 경복궁에서 나와 3호선 2번 출구로 나와 오른쪽으로 돌아서 GS 슈퍼마켓(길 왼쪽)까지 직진한 후 왼쪽으로 돌면 됩니다. 사람이 많으니 일찍 가는 게 좋습니다. 삼계탕은 1인분에 15,000원, 해물파전도 1인분에 15,000원입니다. 개인적으로 삼계탕은 괜찮았지만 해물파전은 별로였습니다."
11921732,ko-KR,4.0,2014년 5월 20일,"북촌에서 경복궁으로 걸어가던 중 갑자기 폭우가 쏟아졌습니다. 다행히 출발 전에 서울 날씨 예보를 확인했는데, 매일 비가 온다고 해서 우산을 챙겨왔습니다. 우산을 쓰고 어머니께 전화를 드리는 동안 비가 그쳤습니다. 제 취향인지는 모르겠지만, 저는 서울의 비가 좋습니다. 베이징처럼 며칠씩 비가 내리다가 겨우 몇 방울씩 떨어지는 것과는 달리, 서울의 비는 갑자기 확 쏟아지니까요. 경복궁 입구에서 1인당 3,000원짜리 입장권을 샀는데, 가격이 정말 저렴했습니다. 중국어 오디오 가이드도 3,000원에 대여했는데, 마치 작은 PDA 같았습니다. 예약한 투어 시간에 맞춰 경로를 짜주고, 궁궐 곳곳을 안내해 주며, 목적지에 도착하면 자동으로 설명을 들려줍니다. 혼자 여행하는 사람들에게는 정말 딱 맞는 제품입니다."
11916321,ko-KR,4.0,2014년 4월 24일,"가본 사람들은 알겠지만&hellip; 경복궁은 자금성의 3분의 1 크기밖에 되지 않고, 자금성의 웅장함에 비하면 다소 소박해 보입니다. 볼거리도 많지 않고요. 만약 개별 여행을 하신다면, 입장료를 내고 경복궁에 가는 건 추천하지 않습니다. 한국의 역사와 문화를 배우는 방법은 경복궁 말고도 많으니까요."
11919297,ko-KR,4.0,2014년 4월 24일,"경복궁은 한국의 자금성과 같은 곳입니다. 고대 고려 왕국의 왕궁이자 황제의 거처였습니다. 자금성에 비하면 훨씬 소박한 모습입니다. 입장료도 비싸지 않습니다. 성인 3,000원, 즉 약 18위안입니다. 요즘 중국에서는 규모에 상관없이 관광지 입장료가 40위안이 넘고, 특히 세계문화유산 같은 유명 관광지는 200위안을 훌쩍 넘는 경우가 많습니다. 아마도 중국만의 독특한 특징인 것 같습니다."
219701840,ko-KR,3.0,2025년 8월 9일,아주 평범하고 지루합니다. 모든 궁궐은 출입이 불가능하거나 대부분 문을 닫았습니다. 외관만 볼 수 있습니다.
180294843,ko-KR,4.0,2024년 1월 5일,"궁궐은 웅장한 홀과 아름다운 정원을 갖춘 거대한 규모로, 방문객들에게 편안하고 여유로운 경험을 선사합니다. 한복을 입은 관리들의 공연도 꼭 관람해 볼 만합니다!"
172919223,ko-KR,4.0,2022년 10월 2일,"팬데믹 이전 국경절 연휴에 그곳의 정원과 집을 방문했었어요. 가장 기억에 남는 건 참배하러 갔을 때 사찰로 내려가는 작은 문이었어요. 안내원이 있었지만, 걸어가는 거리가 꽤 멀었죠. 베이징의 자금성과는 비교할 수 없을 정도로 작았어요."
164518446,ko-KR,5.0,2020년 9월 24일,한국에 대해 조금이라도 아는 사람이라면 누구나 경복궁을 알 것입니다. 꼭 방문해야 할 명소죠. 아름다운 한복을 입고 경복궁에서 사진을 찍는 것은 더욱 특별한 경험을 선사합니다.
180353747,ko-KR,4.0,2024년 1월 9일,드디어 한국 드라마에서 자주 등장하는 경제개발구의 명소인 복궁에 도착했습니다. 마치 꿈속에 있는 듯한 기분이었습니다. 진흙탕이었던 땅조차 푸른 잔디로 뒤덮여 있었습니다.
179795277,ko-KR,5.0,2023년 11월 15일,경복궁은 한복을 찾아오면 무료가 됩니다. 근처에 많은 한복 가게가 있습니다. 호두 한복은 많은 귀여운 것이있었습니다.
176338803,ko-KR,5.0,2023년 6월 19일,"옛 왕이 살았던 곳!
한복을 입고 가면 입장료가 무료도 됩니다 😘
한국 좋아하는 것은 꼭 한번은 방문해야 할 곳입니다 💛"
174967842,ko-KR,5.0,2023년 2월 20일,"아침, 경복궁까지 산책했습니다. 한국 드라마에 잘 나오는 장소에서 감개 깊었습니다!"
171861394,ko-KR,5.0,2022년 8월 1일,"우리나라의 자금성과 같은 곳으로, 최근에야 일반인에게 개방되었습니다. 과거에는 여러 왕조의 황제와 현대에는 대통령의 집무실로 사용되었습니다."
170190527,ko-KR,5.0,2022년 4월 8일,"한국 여행을 계획 중이시라면, 이곳을 방문해 보시길 추천합니다. 자금성만큼 웅장하지는 않지만, 한국 역사를 이해하는 데 충분히 도움이 될 것입니다."
74780832,ko-KR,4.0,2016년 4월 4일,"고층 건물들 사이에서, 특히 옛 정취가 물씬 풍기는 북촌 골목길에서 전통 한옥을 찾아보기는 드뭅니다. 북촌 골목을 조용히 걷다 보면 깨끗한 거리와 정돈된 집들을 곳곳에서 만날 수 있고, 때때로 발걸음을 멈춰 각 집의 특징을 자세히 살펴볼 수도 있습니다."
649130427,ko-KR,5.0,3월 1일,저는 설날 전날 경복궁에 갔는데 입장료가 무료라서 놀랐습니다. 사람이 많지 않아서 사진 찍기에 아주 좋은 장소였습니다.
234490082,ko-KR,5.0,2025년 11월 24일,"경복궁은 서울에서 가장 유명한 관광 명소 중 하나로, 많은 외국인 관광객을 끌어들이고 대중교통으로 쉽게 접근할 수 있습니다. 한국을 처음 방문하는 사람들에게는 잊지 못할 경험을 선사합니다."
173636598,ko-KR,4.0,2022년 11월 14일,경복궁은 시간을 거슬러 여행한 사람들로 가득 차 있어 매우 독특합니다.
170724851,ko-KR,5.0,2022년 5월 20일,웅장하고 아름다워요 너무 넓어 아이들이 걷기 힘들긴한데 쉬어가면서 구경하면 괜찮아요
161170899,ko-KR,4.0,2019년 9월 27일,"서울에 머무는 동안 한국의 대학에서 강의하는 영국인 친구가 저를 경복궁에 데려갔습니다. 궁궐 안에는 전통 한복을 입은 많은 여성들이 있었는데, 마치 고대 한국으로 시간 여행을 온 듯한 느낌이었습니다."
74206270,ko-KR,5.0,2016년 5월 12일,"다들 한국 궁궐박물관은 규모가 작아서 베이징 궁궐박물관에 비하면 한참 못 미친다고 하는데, 저는 정말 좋다고 생각해요. 우리나라 궁궐박물관과는 완전히 다르더라고요! 꼭 다시 오고 싶어요."
73198061,ko-KR,5.0,2016년 4월 29일,한국의 전통 문화는 정말 활기차고 재미있어요!
179431982,ko-KR,5.0,2023년 10월 17일,NCT127이 이번에 캄바했을 때 사용된 장소! 시즈니 여러분 꼭! !
173522421,ko-KR,5.0,2022년 11월 7일,"볼거리가 굉장히 많은 곳. 경복궁을 중심으로 서촌, 북촌, 인사동, 종묘, 청와대, 덕수궁, 창경궁, 창덕궁 등 둘러보기 너무좋음"
172737270,ko-KR,5.0,2022년 9월 20일,"한국 여행을 계획 중이시라면 자금성 방문을 추천합니다. 중국의 자금성만큼 웅장하지는 않지만, 한국 역사를 배울 수 있는 좋은 기회를 제공합니다."
170083398,ko-KR,5.0,2022년 3월 30일,한국의 자금성&mdash;이 표현이 정확한지는 모르겠지만&mdash;은 멋진 곳이에요. 한국 역사에 대해 잘 알지는 못하지만요.
159643185,ko-KR,5.0,2019년 7월 8일,"인스타그램에 올릴 만한 멋진 사진을 찍고 싶다면 경복궁에 꼭 가보세요. 모든 사진이 아름답게 나올 뿐 아니라, 마치 한국 사극 속에 있는 듯한 경험을 할 수 있을 거예요! 강력 추천합니다!"
179933926,ko-KR,5.0,2023년 11월 28일,"한복을 입으면 무료로 넣기 때문에 한복을 입는 것이 추천입니다!
제가 갔을 때에는 이벤트도 하고 좋았습니다!"
173476438,ko-KR,5.0,2022년 11월 5일,매우 문화적인 곳이에요. 제대로 경험하려면 한복을 빌려 입어보세요.
166261429,ko-KR,4.0,2021년 4월 18일,"내부에는 궁궐, 인공 호수, 작은 다리 등이 있습니다. 안타깝게도 경복궁은 과거 화재로 완전히 소실되었기 때문에 현재 우리가 보는 모습은 모두 재건된 것이며, 자연스럽게 옛 정취를 잃어버렸습니다."
